{
  "schema_id": "simai.framework.release-lock",
  "schema_version": 2,
  "compatibility_id": "ui-ad44b1d6ca23",
  "status": "bounded",
  "profile": "plain-assets-v1",
  "runtime_sources": {
    "core": {
      "owner": "simai/ui",
      "tag": null,
      "tag_object": null,
      "revision": "ad44b1d6ca234326a88fc01c68266ed634f4ffb0",
      "commit": "ad44b1d6ca234326a88fc01c68266ed634f4ffb0",
      "tree": "3e7f250dd18234bde46dc9fcbee0886ad03f01dd",
      "runtime_path": "distr",
      "runtime_tree": "89c40ebca652b80ea8940c3173ce7f9db537e26f",
      "archive_sha256": "378b665de00e7523d2d7c60b5daf3b751746240efa264bed261e61e6324080c2"
    },
    "smart": {
      "owner": "simai/ui",
      "tag": null,
      "tag_object": null,
      "revision": "ad44b1d6ca234326a88fc01c68266ed634f4ffb0",
      "commit": "ad44b1d6ca234326a88fc01c68266ed634f4ffb0",
      "tree": "3e7f250dd18234bde46dc9fcbee0886ad03f01dd",
      "runtime_path": "distr/smart",
      "runtime_tree": "e0a83c92880cefe4770cf0b81c5e475cc5f40e3e",
      "archive_sha256": "931a74c4ba904180136404b6310ecb6ef5d2cae9daf6d6987d5ae7466c22916c"
    }
  },
  "build_inputs": {
    "source": {
      "owner": "simai/ui-source",
      "commit": "be1d8fa7a84a0ce453d6d913eb7255700923acfa",
      "tree": "ec586a6be31272e03b905ef36d0efc65bcc97b11",
      "archive_sha256": "93126542ca847ba7054c6c87410032cbf191b62b223a4fc4e03673fdfc0c5665"
    },
    "builder": {
      "owner": "simai/ui-builder",
      "commit": "7f6d4ce92bcdc0cf83fe3d3bbe971226e829cff9",
      "tree": "abbd9e5db6f5de40275097becb06ecae4fcf62d5",
      "archive_sha256": "9227c0e08c10b7b71f2580a2e25105dc6a5fdec2d8893a1047607e7c08843455"
    },
    "legacy_compatibility": {
      "required": false
    }
  },
  "inventory": {
    "utility_rules": 738,
    "utility_families": 228,
    "components": 62,
    "smart_components": 53,
    "recipes": 1
  },
  "exclusions": [],
  "claims": {
    "full_compatible": false,
    "production_ready": false,
    "all_items_ready": false
  }
}
