{
  "schema_id": "simai.framework.release-lock",
  "schema_version": 2,
  "compatibility_id": "ui-272734e6edf3",
  "status": "bounded",
  "profile": "plain-assets-v1",
  "runtime_sources": {
    "core": {
      "owner": "simai/ui",
      "tag": null,
      "tag_object": null,
      "revision": "272734e6edf378dc97d957ab2baa78503a526c16",
      "commit": "272734e6edf378dc97d957ab2baa78503a526c16",
      "tree": "75ee9f36390e3362dd351f19a3887344ec403de1",
      "runtime_path": "distr",
      "runtime_tree": "7abd9fab679bb65634481742dc203355d882f00a",
      "archive_sha256": "ab103b5b8f8670023c021e38cc14194ad35eb6f32e6dfa433ef577e0da2f4aa4"
    },
    "smart": {
      "owner": "simai/ui",
      "tag": null,
      "tag_object": null,
      "revision": "272734e6edf378dc97d957ab2baa78503a526c16",
      "commit": "272734e6edf378dc97d957ab2baa78503a526c16",
      "tree": "75ee9f36390e3362dd351f19a3887344ec403de1",
      "runtime_path": "distr/smart",
      "runtime_tree": "67fe3ad37a3ee1a9fb0755991b31d1744986d48f",
      "archive_sha256": "9563c85c77d17d25bcce548f32d6047713f61424ab225dcc85de4f8e1280963d"
    }
  },
  "build_inputs": {
    "source": {
      "owner": "simai/ui-source",
      "commit": "02b5e484fbbfe244f98e7c7a9e60436c0f765b24",
      "tree": "463b6abced45bc611b11c993e9770837c786a838",
      "archive_sha256": "a2dbb65ccaf2493441c3bb013712db66f4a423ecadd3108b52be30cb231eda79"
    },
    "builder": {
      "owner": "simai/ui-builder",
      "commit": "c19b7c4f891e0c75dd85114d876800fd749de18b",
      "tree": "a71c7191eb3645c245ea7ef6f3632d44686d62b8",
      "archive_sha256": "238aba448f7a6ade502757a25549066fd3a1416717912ea1ded67f2f40556600"
    },
    "legacy_compatibility": {
      "required": false
    }
  },
  "inventory": {
    "utility_rules": 738,
    "utility_families": 228,
    "components": 62,
    "smart_components": 48,
    "recipes": 1
  },
  "exclusions": [],
  "claims": {
    "full_compatible": false,
    "production_ready": false,
    "all_items_ready": false
  }
}
