{
  "schema_id": "simai.framework.release-lock",
  "schema_version": 2,
  "compatibility_id": "ui-40382a5fbd9f",
  "status": "bounded",
  "profile": "plain-assets-v1",
  "runtime_sources": {
    "core": {
      "owner": "simai/ui",
      "tag": null,
      "tag_object": null,
      "revision": "40382a5fbd9f5548b24adf4f14b9598134290a88",
      "commit": "40382a5fbd9f5548b24adf4f14b9598134290a88",
      "tree": "d996d1358de97c17aebc75a2358b6b444d230b08",
      "runtime_path": "distr",
      "runtime_tree": "f9dadd7f14ec744a8032e2f3b0eef6de00e3c004",
      "archive_sha256": "11dfac021a799f686425e93cfc563fe42b4ba5838bcfe1a94d6a83d5563a1fa0"
    },
    "smart": {
      "owner": "simai/ui",
      "tag": null,
      "tag_object": null,
      "revision": "40382a5fbd9f5548b24adf4f14b9598134290a88",
      "commit": "40382a5fbd9f5548b24adf4f14b9598134290a88",
      "tree": "d996d1358de97c17aebc75a2358b6b444d230b08",
      "runtime_path": "distr/smart",
      "runtime_tree": "dd6ba901eb5175a0577e5bb7a8436e0b7d0bc951",
      "archive_sha256": "17d9ec3d3f3c86c0f73321ba99a1857d54d90688405f5be6db10d5c1acd5ee76"
    }
  },
  "build_inputs": {
    "source": {
      "owner": "simai/ui-source",
      "commit": "08c848fec518f6e9adcb20f0f9ccdc9981203c4f",
      "tree": "98542d563f198fbd9a0ad552cd828069555bf270",
      "archive_sha256": "cbcf139b552188c587e5615a6a1a454f4370b5834ebb92bb095d916e3970b264"
    },
    "builder": {
      "owner": "simai/ui-builder",
      "commit": "412e55de40ffd95671b0b2abdcf09c86cab6a4fd",
      "tree": "0bddbb3e6745fe7baf7702985306c038c4eeca34",
      "archive_sha256": "4266f25b4819b15902619a6461ac0d0304a4a00afcdbaf7190492b170fd1659d"
    },
    "legacy_compatibility": {
      "required": false
    }
  },
  "inventory": {
    "utility_rules": 738,
    "utility_families": 228,
    "components": 62,
    "smart_components": 48,
    "recipes": 1
  },
  "exclusions": [],
  "claims": {
    "full_compatible": false,
    "production_ready": false,
    "all_items_ready": false
  }
}
