{
  "schema_id": "simai.framework.release-lock",
  "schema_version": 2,
  "compatibility_id": "ui-e3d86b6f903a",
  "status": "bounded",
  "profile": "plain-assets-v1",
  "runtime_sources": {
    "core": {
      "owner": "simai/ui",
      "tag": null,
      "tag_object": null,
      "revision": "e3d86b6f903a334b0c81f604ea7f0fff32555f98",
      "commit": "e3d86b6f903a334b0c81f604ea7f0fff32555f98",
      "tree": "0305b12e24aebfc3722f8722fc023686b0328f34",
      "runtime_path": "distr",
      "runtime_tree": "3fe49af5d276a8bbf1b597811aebe5731a503ff0",
      "archive_sha256": "ed290e08eae1b7c0f1d5fee51f430f64319439dfa658901cad9e43a62b0d2a5f"
    },
    "smart": {
      "owner": "simai/ui",
      "tag": null,
      "tag_object": null,
      "revision": "e3d86b6f903a334b0c81f604ea7f0fff32555f98",
      "commit": "e3d86b6f903a334b0c81f604ea7f0fff32555f98",
      "tree": "0305b12e24aebfc3722f8722fc023686b0328f34",
      "runtime_path": "distr/smart",
      "runtime_tree": "b1fdbe02fdbc573d0232c4c59c6ddd3564556dbb",
      "archive_sha256": "005878f0d099cb6861cc29921fd492a30a4fbc9d43237cc3a4aa219a448fc37b"
    }
  },
  "build_inputs": {
    "source": {
      "owner": "simai/ui-source",
      "commit": "758b6fd578dc02a0ecd629f09b0e4a2312341f16",
      "tree": "6108ef385c1205b1f9c245cf734fd51241853333",
      "archive_sha256": "6c6d5c2e903efc5a3d35cc9ad8f7da3d76ec3858a7ff0e425a35b4e157430157"
    },
    "builder": {
      "owner": "simai/ui-builder",
      "commit": "ac9f4f4d058605574c2b91daa07d96026f69d39d",
      "tree": "b564266901acf8df4bf40c27f5729469fd85aa47",
      "archive_sha256": "b0403c11fba4b00857f4e03fe52a72b43586dfc5e5e100c04ea2538d5d4ff87c"
    },
    "legacy_compatibility": {
      "required": false
    }
  },
  "inventory": {
    "utility_rules": 738,
    "utility_families": 228,
    "components": 62,
    "smart_components": 59,
    "recipes": 1
  },
  "exclusions": [],
  "claims": {
    "full_compatible": false,
    "production_ready": false,
    "all_items_ready": false
  }
}
